{"$schema":"https://json-schema.org/draft/2020-12/schema","$id":"https://github.com/Hawkar-usls/AIFC/schemas/semantic-bridge-endpoint-identity-profile-v1.schema.json","title":"AIFC Semantic Bridge Endpoint Identity Profile v1","type":"object","additionalProperties":false,"required":["schema","profile_id","entailment_question_id","predecessor_formula_source_path","predecessor_formula_git_blob_sha1","predecessor_formula_content_hash","target_formula_source_path","target_formula_git_blob_sha1","target_formula_content_hash","bridge_axiom_schema_id","derived_semantic_object_schema_id","predecessor_endpoint_rule","target_endpoint_rule","derived_atom_rule","implementation_path","implementation_git_blob_sha1","implementation_raw_sha256","profile_authority_status","authority_lineage_status","profile_content_hash"],"properties":{"schema":{"const":"AIFC/semantic-bridge-endpoint-identity-profile/v1"},"profile_id":{"type":"string","minLength":1},"entailment_question_id":{"type":"string","pattern":"^[0-9a-f]{64}$"},"predecessor_formula_source_path":{"type":"string","pattern":"^conformance/"},"predecessor_formula_git_blob_sha1":{"type":"string","pattern":"^[0-9a-f]{40}$"},"predecessor_formula_content_hash":{"type":"string","pattern":"^[0-9a-f]{64}$"},"target_formula_source_path":{"type":"string","pattern":"^conformance/"},"target_formula_git_blob_sha1":{"type":"string","pattern":"^[0-9a-f]{40}$"},"target_formula_content_hash":{"type":"string","pattern":"^[0-9a-f]{64}$"},"bridge_axiom_schema_id":{"const":"AIFC/semantic-bridge-axiom/v2"},"derived_semantic_object_schema_id":{"const":"AIFC/bridge-derived-semantic-object/v1"},"predecessor_endpoint_rule":{"const":"ATOM_IN_PREDECESSOR_NAMESPACE_AND_IDENTITY_EQUALS_CANONICAL_PREDECESSOR_BINDING"},"target_endpoint_rule":{"const":"ATOM_IN_TARGET_NAMESPACE_AND_IDENTITY_EQUALS_CANONICAL_TARGET_BINDING"},"derived_atom_rule":{"const":"ATOM_DISJOINT_FROM_BOTH_ENDPOINT_NAMESPACES_AND_RESOLVES_CONTENT_IDENTIFIED_LINEAGED_DERIVATION"},"implementation_path":{"type":"string","minLength":1},"implementation_git_blob_sha1":{"type":"string","pattern":"^[0-9a-f]{40}$"},"implementation_raw_sha256":{"type":"string","pattern":"^[0-9a-f]{64}$"},"profile_authority_status":{"enum":["SUCCESSOR_CANDIDATE_NOT_AUTHORITY_ADMISSIBLE","AUTHORITY_ADMISSIBLE"]},"authority_lineage_status":{"enum":["NOT_ESTABLISHED","AUTHORITY_LINEAGE_ESTABLISHED"]},"profile_content_hash":{"type":"string","pattern":"^[0-9a-f]{64}$"}},"description":"Content-identified rules that preserve semantic identity of bridge endpoints and isolate bridge-derived atoms."}
