{"schema":"AIFC/semantic-bridge-endpoint-identity-profile/v1","profile_id":"AIFC-SAL-V1.10-SEMANTIC-BRIDGE-ENDPOINT-IDENTITY-PROFILE-V1","entailment_question_id":"994c979c702b81a0940f28b8039ad36cb48060c426f42eb1f333bf1630e473b6","predecessor_formula_source_path":"conformance/AIFC-PREDECESSOR-SEMANTIC-FORMULA-v1.json","predecessor_formula_git_blob_sha1":"81d70057c41dd8e5e7fe14d155a661dda5c901ff","predecessor_formula_content_hash":"b8d4771e7fc598ef3398b6995323fbd8d0b3b9f8b86b1b8b736d990527a88353","target_formula_source_path":"conformance/AIFC-TARGET-SEMANTIC-FORMULA-v1.json","target_formula_git_blob_sha1":"9f2f25aade7d899f3a6dc6c28bb544ab759105aa","target_formula_content_hash":"74f0bac1ee3c2229fff6f1b92e1c02fc4a9439c43ab56bc6d199b261c7def047","bridge_axiom_schema_id":"AIFC/semantic-bridge-axiom/v2","derived_semantic_object_schema_id":"AIFC/bridge-derived-semantic-object/v1","predecessor_endpoint_rule":"ATOM_IN_PREDECESSOR_NAMESPACE_AND_IDENTITY_EQUALS_CANONICAL_PREDECESSOR_BINDING","target_endpoint_rule":"ATOM_IN_TARGET_NAMESPACE_AND_IDENTITY_EQUALS_CANONICAL_TARGET_BINDING","derived_atom_rule":"ATOM_DISJOINT_FROM_BOTH_ENDPOINT_NAMESPACES_AND_RESOLVES_CONTENT_IDENTIFIED_LINEAGED_DERIVATION","implementation_path":"reference/verifier/semantic_bridge_endpoint_identity_v1.py","implementation_git_blob_sha1":"2afc918646fad98445efb6eff5ea11c8a20dee97","implementation_raw_sha256":"42c2a968645b433698c9ba4c9f7348e535be580fce6cf25b33320f1026a59a67","profile_authority_status":"SUCCESSOR_CANDIDATE_NOT_AUTHORITY_ADMISSIBLE","authority_lineage_status":"NOT_ESTABLISHED","profile_content_hash":"a86c5695e207b1471507d819899b9536d728cf913ba86adab30516c7be3ea68e"}
